{
  "id": "simple_mace",
  "name": "Булава",
  "price_gold": 100,
  "image": "res://assets/equipment/simple-mace.png",
  "category": "weapon",
  "equip_slots": ["left_hand", "right_hand"],
  "size_cells": {"height": 3, "width": 2},
  "weapon": {
    "type": "mace",
    "damage_dice": "1d6",
    "accuracy_bonus": 1
  }
}
